{
  "learning_note_id": "learn-stu-kim-minji-calculus-1-calculus-1-2026-spring-a",
  "student_id": "stu-kim-minji",
  "course_id": "course-calculus-1",
  "class_id": "class-calculus-1-2026-spring-a",
  "concepts": [
    "chain rule",
    "product rule",
    "composition"
  ],
  "gaps": [
    "Distinguish chain-rule and product-rule expressions by the expression structure first.",
    "Recheck substitution boundaries before applying the method across later units."
  ],
  "next_actions": [
    "Review the chain-rule wiki page and classify two nested-structure examples.",
    "Ask a follow-up question with examples before applying substitution broadly."
  ],
  "summary": "The student repeatedly needs help deciding which rule applies before executing the derivative steps.",
  "source_refs": [
    {
      "source_id": "src-lecture-note-class-calculus-1-2026-spring-a-week-03-20260408T103000Z",
      "source_type": "lecture_note",
      "chunk_id": "core-rule"
    },
    {
      "source_id": "src-lecture-note-class-calculus-1-2026-spring-a-chain-rule-support-20260408T111500Z",
      "source_type": "lecture_note",
      "chunk_id": "recommended-intervention"
    }
  ],
  "session_refs": [
    "ses-student-stu-kim-minji-class-calculus-1-2026-spring-a-20260407T133000Z",
    "ses-student-stu-kim-minji-class-calculus-1-2026-spring-a-20260408T091000Z",
    "ses-student-stu-kim-minji-class-calculus-1-2026-spring-a-20260408T114000Z"
  ],
  "created_at": "2026-04-07T13:35:00Z",
  "updated_at": "2026-04-08T11:42:00Z"
}
