{
  "learning_note_id": "learn-stu-kim-minji-calculus-1-calculus-1-2026-spring-a",
  "student_id": "stu-kim-minji",
  "course_id": "course-calculus-1",
  "class_id": "class-calculus-1-2026-spring-a",
  "concepts": [
    "chain rule",
    "product rule",
    "composition"
  ],
  "gaps": [
    "연쇄법칙과 곱의 미분법을 식의 구조 기준으로 먼저 구분하기",
    "substitution이 항상 가능한 것은 아니라는 점을 later units 기준으로 다시 확인하기"
  ],
  "next_actions": [
    "연쇄법칙 위키 페이지를 다시 읽고 nested structure 예제를 두 개 직접 구분해 보기",
    "다음 Ask에서 substitution boundary를 예시와 함께 다시 질문해 보기"
  ],
  "summary": "민지는 규칙 자체보다 어떤 식에서 어떤 rule을 먼저 적용해야 하는지 판단하는 단계에서 반복적으로 막히고 있습니다.",
  "source_refs": [
    {
      "source_id": "src-lecture-note-class-calculus-1-2026-spring-a-week-03-20260408T103000Z",
      "source_type": "lecture_note",
      "chunk_id": "core-rule"
    },
    {
      "source_id": "src-lecture-note-class-calculus-1-2026-spring-a-chain-rule-support-20260408T111500Z",
      "source_type": "lecture_note",
      "chunk_id": "recommended-intervention"
    }
  ],
  "session_refs": [
    "ses-student-stu-kim-minji-class-calculus-1-2026-spring-a-20260407T133000Z",
    "ses-student-stu-kim-minji-class-calculus-1-2026-spring-a-20260408T091000Z",
    "ses-student-stu-kim-minji-class-calculus-1-2026-spring-a-20260408T114000Z"
  ],
  "created_at": "2026-04-07T13:35:00Z",
  "updated_at": "2026-04-08T11:42:00Z"
}
